{
  "$schema": "./retirement-manifest.schema.json",
  "schemaVersion": "1.0",
  "systemVersion": "2.0.0",
  "policy": "Rev C and Rev D are retired as forward authority. Active compatibility consumers may remain only with a named exit gate; no new work may import their identity.",
  "consumers": [
    {
      "id": "rev-c-root-design-system",
      "path": "../tokens",
      "legacyAuthority": "rev-c",
      "currentUse": "Root CSS token and component compatibility implementation.",
      "replacementBinding": "./bindings/color.json",
      "owner": "design-system",
      "status": "blocked",
      "exitGate": "All active consumers use verified Boundary Ledger bindings or an explicit historical fixture.",
      "verificationEvidence": null,
      "allowedForNewWork": false,
      "preserveAsHistory": true
    },
    {
      "id": "production-site",
      "path": "../../site",
      "legacyAuthority": "rev-c",
      "currentUse": "Production site colors, layout surfaces, and episode components.",
      "replacementBinding": "web",
      "owner": "site",
      "status": "blocked",
      "exitGate": "Production routes pass responsive, accessibility, visual-regression, and live-runtime verification on Boundary Ledger.",
      "verificationEvidence": null,
      "allowedForNewWork": false,
      "preserveAsHistory": false
    },
    {
      "id": "studio-brand-config",
      "path": "../../studio/config/brand.json",
      "legacyAuthority": "rev-c",
      "currentUse": "Shared legacy video, short-form, and derived-artifact brand values.",
      "replacementBinding": "color + motion + sound",
      "owner": "studio",
      "status": "blocked",
      "exitGate": "Every active studio consumer resolves hash-pinned Boundary Ledger bindings and passes representative renders.",
      "verificationEvidence": null,
      "allowedForNewWork": false,
      "preserveAsHistory": false
    },
    {
      "id": "remotion-compatibility-runtime",
      "path": "../../studio/remotion",
      "legacyAuthority": "rev-c",
      "currentUse": "Historical and compatibility video graphics and scene families.",
      "replacementBinding": "motion",
      "owner": "studio",
      "status": "blocked",
      "exitGate": "Active new production routes through Blueprint Cinema, HyperFrames, and Resolve; retained Remotion fixtures are labeled historical.",
      "verificationEvidence": null,
      "allowedForNewWork": false,
      "preserveAsHistory": true
    },
    {
      "id": "blueprint-pdf-renderer",
      "path": "../../studio/scripts/originate/render_blueprint.py",
      "legacyAuthority": "rev-c",
      "currentUse": "Operator Blueprint and PDF surface rendering.",
      "replacementBinding": "static-editorial",
      "owner": "studio",
      "status": "blocked",
      "exitGate": "A Boundary Ledger PDF reference passes print, source, typography, and accessibility inspection.",
      "verificationEvidence": null,
      "allowedForNewWork": false,
      "preserveAsHistory": false
    },
    {
      "id": "rev-d-direction",
      "path": "../REV-D-NARRATIVE-SYSTEM.md",
      "legacyAuthority": "rev-d-derived",
      "currentUse": "Archived human-stakes, reversal, and sound research.",
      "replacementBinding": "./semantic-core.json",
      "owner": "design-system",
      "status": "historical",
      "exitGate": "File carries a superseded header and active authority docs no longer route new work through it.",
      "verificationEvidence": null,
      "allowedForNewWork": false,
      "preserveAsHistory": true
    },
    {
      "id": "rev-d-score-state-config",
      "path": "../../studio/config/blueprint.json",
      "legacyAuthority": "rev-d-derived",
      "currentUse": "Human, constraint, tension, silence, counter, build, and resolve score states.",
      "replacementBinding": "./bindings/sound.json",
      "owner": "studio",
      "status": "blocked",
      "exitGate": "Score-state generation derives from a selected, tested Boundary Ledger sound binding without changing editorial meaning.",
      "verificationEvidence": null,
      "allowedForNewWork": false,
      "preserveAsHistory": false
    },
    {
      "id": "rev-d-score-scripts",
      "path": "../../studio/scripts/originate/music_brief.py",
      "legacyAuthority": "rev-d-derived",
      "currentUse": "Rev-D-derived music briefing behavior.",
      "replacementBinding": "./bindings/sound.json",
      "owner": "studio",
      "status": "blocked",
      "exitGate": "Music briefing resolves only current sound-role IDs and passes an audio-first episode test.",
      "verificationEvidence": null,
      "allowedForNewWork": false,
      "preserveAsHistory": false
    },
    {
      "id": "rev-d-score-arrangement",
      "path": "../../studio/scripts/originate/arrange_episode_score.py",
      "legacyAuthority": "rev-d-derived",
      "currentUse": "Rev-D-derived score-state arrangement behavior.",
      "replacementBinding": "./bindings/sound.json",
      "owner": "studio",
      "status": "blocked",
      "exitGate": "Arrangement consumes only current sound-role IDs and an explicitly selected identity-sound policy.",
      "verificationEvidence": null,
      "allowedForNewWork": false,
      "preserveAsHistory": false
    },
    {
      "id": "rev-d-storyboard-evaluator",
      "path": "../../studio/scripts/originate/eval_storyboard.py",
      "legacyAuthority": "rev-d-derived",
      "currentUse": "Legacy storyboard evaluation against Rev-D-derived visual and motion expectations.",
      "replacementBinding": "./bindings/motion.json",
      "owner": "studio",
      "status": "blocked",
      "exitGate": "Active visual evaluation validates the hash-pinned Boundary Ledger core and approved Step 3 lock.",
      "verificationEvidence": null,
      "allowedForNewWork": false,
      "preserveAsHistory": false
    },
    {
      "id": "rev-d-storyboard-review",
      "path": "../../studio/scripts/originate/storyboard_review.py",
      "legacyAuthority": "rev-d-derived",
      "currentUse": "Legacy storyboard review output with Rev-D-derived scene language.",
      "replacementBinding": "./bindings/motion.json",
      "owner": "studio",
      "status": "blocked",
      "exitGate": "Review output reports Boundary Ledger roles and operations without inventing a competing motion vocabulary.",
      "verificationEvidence": null,
      "allowedForNewWork": false,
      "preserveAsHistory": false
    },
    {
      "id": "rev-d-longform-preparation",
      "path": "../../studio/scripts/originate/prepare_longform.py",
      "legacyAuthority": "rev-d-derived",
      "currentUse": "Opening identity, preview, and narrative-motion compatibility behavior.",
      "replacementBinding": "./bindings/motion.json",
      "owner": "studio",
      "status": "blocked",
      "exitGate": "Long-form preparation consumes the Step 3 Boundary Ledger lock and no longer authors Rev-D-specific motion semantics.",
      "verificationEvidence": null,
      "allowedForNewWork": false,
      "preserveAsHistory": false
    },
    {
      "id": "oe-sting",
      "path": "../OE-STING-SPEC.md",
      "legacyAuthority": "rev-d-derived",
      "currentUse": "Unresolved 2.4-second identity-sound specification and legacy episode compatibility.",
      "replacementBinding": "./bindings/sound.json",
      "owner": "design-system + audio",
      "status": "blocked",
      "exitGate": "Owner chooses retain-and-rebind, replace, or legacy-only; selected master and provenance are then verified.",
      "verificationEvidence": null,
      "allowedForNewWork": false,
      "preserveAsHistory": true
    },
    {
      "id": "ep006-rev-e-contract",
      "path": "../../studio/originate/direct-booking-recovery/REV-E-CONTRACT.md",
      "legacyAuthority": "rev-d-derived",
      "currentUse": "Episode-specific compatibility contract retaining Booking blue, ledger gold, and gravity semantics.",
      "replacementBinding": "./semantic-core.json + ./bindings/motion.json",
      "owner": "episode-production",
      "status": "blocked",
      "exitGate": "EP006 receives an approved Step 3 Boundary Ledger lock or this contract is labeled historical-only.",
      "verificationEvidence": null,
      "allowedForNewWork": false,
      "preserveAsHistory": true
    },
    {
      "id": "ep006-rev-e-narrative",
      "path": "../../studio/originate/direct-booking-recovery/REV-E-NARRATIVE.md",
      "legacyAuthority": "rev-d-derived",
      "currentUse": "Episode-specific compatibility direction retaining a gold reverse path and identity break.",
      "replacementBinding": "./semantic-core.json + ./bindings/motion.json + ./bindings/sound.json",
      "owner": "episode-production",
      "status": "blocked",
      "exitGate": "EP006 receives an approved Step 3 Boundary Ledger lock and verified cross-media implementation or this file is historical-only.",
      "verificationEvidence": null,
      "allowedForNewWork": false,
      "preserveAsHistory": true
    }
  ]
}
